{
  "$schema": "./architecture-gate.schema.json",
  "comment": "Legacy exceptions for Architecture V2 migration. New code must NOT be added to this list. Justifications: workerRuntimeAdapter.ts / llmBrokerBridge.ts / stepWorkloadIdentity.ts are deliberate V1-to-V2 runtime bridges (ControlPlane identity + agent runtime) quarantined while the strangler migration completes; companion *.test.ts files import core reset helpers for those bridges; esmCompat.ts/agentBenchmarkRunner.ts are API helpers, not public routes; apps/api/src/a2aAuth.ts, enterpriseGateway.ts, healthProbes.ts, openApiGenerator.ts, profileSignal.ts, and refreshTokenStore.ts are auth/middleware/probe/spec/store helpers; actionGatewayEndpoints.ts is the versioned /v1/actions router despite living at the legacy source root; apps/api/src/v2/v2BenchEndpoints.ts is an in-memory benchmark harness isolated from durable execution; capabilityAuthority.ts indexes configured JWKS keys only while replay/revocation authority is PostgreSQL; inMemoryOutboxDeliveryPort.ts and ticketAdapter.ts are local/demo adapters; sqlite.ts/sqlitePool.ts are compatibility implementations rejected by production repository boot.",
  "v2Packages": [
    "packages/kernel",
    "packages/worker-plane",
    "packages/effect-broker",
    "packages/contracts"
  ],
  "forbiddenCoreImports": [
    "@praetor/core",
    "@praetor/core/runtime",
    "@praetor/core/runtime/tenantContext",
    "@praetor/core/observability",
    "@praetor/core/saga",
    "@praetor/core/security",
    "@praetor/core/plugins/im/dingtalk",
    "@praetor/core/plugins/im/feishu",
    "@praetor/core/plugins/im/wecom",
    "@praetor/core/plugins/im/slack",
    "@praetor/core/plugins/im/teams",
    "@praetor/core/plugins/im/discord",
    "@commander/core",
    "@commander/core/runtime",
    "@commander/core/runtime/tenantContext",
    "@commander/core/observability",
    "@commander/core/saga",
    "@commander/core/security",
    "@commander/core/plugins/im/dingtalk",
    "@commander/core/plugins/im/feishu",
    "@commander/core/plugins/im/wecom",
    "@commander/core/plugins/im/slack",
    "@commander/core/plugins/im/teams",
    "@commander/core/plugins/im/discord"
  ],
  "v2ImportExceptions": [
    "packages/worker-plane/src/workerRuntimeAdapter.ts",
    "packages/worker-plane/src/llmBrokerBridge.ts",
    "packages/worker-plane/src/llmBrokerBridge.test.ts",
    "packages/worker-plane/src/llmBrokerIdempotency.test.ts",
    "packages/worker-plane/src/stepWorkloadIdentity.ts",
    "packages/worker-plane/src/stepWorkloadIdentity.test.ts",
    "packages/worker-plane/src/workerService.ts",
    "packages/worker-plane/src/workerService.test.ts"
  ],
  "api": {
    "path": "apps/api/src",
    "legacyImportExceptions": [
      "a2aEndpoints.ts",
      "a2aTask.ts",
      "a2aV2Endpoints.ts",
      "actionRationale.ts",
      "agentCard.ts",
      "agentCardEndpoints.ts",
      "agentRuntimeRegistry.ts",
      "agentStateStore.ts",
      "apiKeyEndpoints.ts",
      "apiKeyStore.ts",
      "approvalConfigEndpoints.ts",
      "atomicWrite.ts",
      "auditLogEndpoints.ts",
      "auditMiddleware.ts",
      "authMiddleware.ts",
      "chatEndpoints.ts",
      "confidenceEndpoints.ts",
      "confidenceReporter.ts",
      "conflictDetection.ts",
      "conflictEndpoints.ts",
      "consensusEndpoints.ts",
      "consistencyMonitor.ts",
      "contentScanner.ts",
      "costDashboardEndpoints.ts",
      "costEndpoints.ts",
      "dlqEndpoints.ts",
      "envSignal.ts",
      "evalEndpoints.ts",
      "evaluation.ts",
      "evaluationEndpoints.ts",
      "evaluationRunner.ts",
      "evaluationRunnerEndpoints.ts",
      "governanceCheckpoint.ts",
      "governanceEndpoints.ts",
      "governanceObserver.ts",
      "hallucinationEndpoints.ts",
      "hubCorrelationsEndpoints.ts",
      "index.ts",
      "jwtMiddleware.ts",
      "knowledgeBaseEndpoints.ts",
      "knowledgeStore.ts",
      "legacyExecutionGuard.ts",
      "lineageEndpoints.ts",
      "mcpEndpoints.ts",
      "memoryIndexEndpoints.ts",
      "memoryIndexManager.ts",
      "memoryPoisoningDetector.ts",
      "memoryStoreAdapter.ts",
      "namespacedMemoryEndpoints.ts",
      "observabilityEndpoints.ts",
      "oidcAuthEndpoints.ts",
      "onboardingEndpoints.ts",
      "orchestrator.ts",
      "orchestratorEndpoints.ts",
      "outgoingWebhookEndpoints.ts",
      "patternStateMachine.ts",
      "pauseEndpoints.ts",
      "pipelineEndpoints.ts",
      "projectEndpoints.ts",
      "qualityEndpoints.ts",
      "reasoningConfig.ts",
      "reasoningConfigEndpoints.ts",
      "refreshTokenStore.ts",
      "replayEndpoints.ts",
      "reportingEndpoints.ts",
      "routeHelpers.ts",
      "routerRegistry.ts",
      "sagaEndpoints.ts",
      "schemas.ts",
      "scimEndpoints.ts",
      "scimStore.ts",
      "scimUserStore.ts",
      "securityEndpoints.ts",
      "securityMiddleware.ts",
      "securityPostureEndpoints.ts",
      "selfAssessment.ts",
      "selfAssessmentEndpoints.ts",
      "sequentialExecutor.ts",
      "settingsEndpoints.ts",
      "settingsStore.ts",
      "sharedRuntime.ts",
      "stateMachine.ts",
      "stateMachineEndpoints.ts",
      "store.ts",
      "stores/apiStore.ts",
      "streamEndpoints.ts",
      "teamEndpoints.ts",
      "tenantContextMiddleware.ts",
      "tenantMetricsExporter.ts",
      "tenantProviderLoader.ts",
      "userAuthEndpoints.ts",
      "userStore.ts",
      "v1GatewayEndpoints.ts",
      "v1GatewayKernel.ts",
      "v1TenantGuard.ts",
      "validationMiddleware.ts",
      "webhookCrypto.ts",
      "webhookEndpoints.ts",
      "workflowEndpoints.ts"
    ],
    "unversionedRouteExceptions": [
      "actionRationale.ts",
      "agentCard.ts",
      "agentCardEndpoints.ts",
      "agentRuntimeRegistry.ts",
      "agentStateStore.ts",
      "apiKeyEndpoints.ts",
      "apiKeyStore.ts",
      "approvalConfigEndpoints.ts",
      "auditLogEndpoints.ts",
      "auditMiddleware.ts",
      "authMiddleware.ts",
      "a2aEndpoints.ts",
      "a2aTask.ts",
      "a2aV2Endpoints.ts",
      "confidenceEndpoints.ts",
      "confidenceReporter.ts",
      "conflictDetection.ts",
      "conflictEndpoints.ts",
      "consensusEndpoints.ts",
      "consistencyMonitor.ts",
      "contentScanner.ts",
      "costDashboardEndpoints.ts",
      "costEndpoints.ts",
      "dlqEndpoints.ts",
      "envSignal.ts",
      "evalEndpoints.ts",
      "evaluation.ts",
      "evaluationEndpoints.ts",
      "evaluationRunner.ts",
      "evaluationRunnerEndpoints.ts",
      "governanceCheckpoint.ts",
      "governanceEndpoints.ts",
      "governanceObserver.ts",
      "hallucinationEndpoints.ts",
      "hubCorrelationsEndpoints.ts",
      "index.ts",
      "jwtMiddleware.ts",
      "knowledgeBaseEndpoints.ts",
      "knowledgeStore.ts",
      "lineageEndpoints.ts",
      "legacyExecutionGuard.ts",
      "mcpEndpoints.ts",
      "memoryIndexEndpoints.ts",
      "memoryIndexManager.ts",
      "memoryPoisoningDetector.ts",
      "memoryStore.ts",
      "memoryStoreAdapter.ts",
      "namespacedMemoryEndpoints.ts",
      "namespacedMemoryStore.ts",
      "observabilityEndpoints.ts",
      "oidcAuthEndpoints.ts",
      "onboardingEndpoints.ts",
      "openApiSpec.ts",
      "orchestrator.ts",
      "orchestratorEndpoints.ts",
      "outgoingWebhookEndpoints.ts",
      "patternStateMachine.ts",
      "pipelineEndpoints.ts",
      "projectEndpoints.ts",
      "qualityEndpoints.ts",
      "reasoningConfig.ts",
      "reasoningConfigEndpoints.ts",
      "replayEndpoints.ts",
      "reportingEndpoints.ts",
      "routeHelpers.ts",
      "routerRegistry.ts",
      "sagaEndpoints.ts",
      "schemas.ts",
      "scimEndpoints.ts",
      "scimStore.ts",
      "scimUserStore.ts",
      "securityEndpoints.ts",
      "securityMiddleware.ts",
      "securityPostureEndpoints.ts",
      "selfAssessment.ts",
      "selfAssessmentEndpoints.ts",
      "sequentialExecutor.ts",
      "settingsEndpoints.ts",
      "settingsStore.ts",
      "stateMachine.ts",
      "stateMachineEndpoints.ts",
      "store.ts",
      "stores/apiStore.ts",
      "streamEndpoints.ts",
      "teamEndpoints.ts",
      "tenantContextMiddleware.ts",
      "tenantMetricsExporter.ts",
      "tenantProviderLoader.ts",
      "userAuthEndpoints.ts",
      "userStore.ts",
      "validationMiddleware.ts",
      "workflowEndpoints.ts",
      "agentBenchmarkRunner.ts",
      "esmCompat.ts",
      "webhookCrypto.ts",
      "webhookEndpoints.ts",
      "chatEndpoints.ts",
      "sharedRuntime.ts",
      "pauseEndpoints.ts",
      "atomicWrite.ts",
      "a2aAuth.ts",
      "actionGatewayEndpoints.ts",
      "enterpriseGateway.ts",
      "healthProbes.ts",
      "openApiGenerator.ts",
      "profileSignal.ts",
      "refreshTokenStore.ts"
    ]
  },
  "authorityExceptions": [
    "packages/worker-plane/src/registry.ts",
    "packages/worker-plane/src/workerRuntimeAdapter.ts",
    "packages/effect-broker/src/index.ts",
    "packages/kernel/src/capabilityAuthority.ts",
    "packages/kernel/src/ops/outbox/inMemoryOutboxDeliveryPort.ts",
    "packages/kernel/src/sqlite.ts",
    "packages/kernel/src/sqlitePool.ts",
    "packages/worker-plane/src/ticketAdapter.ts",
    "apps/api/src/a2aV2Endpoints.ts",
    "apps/api/src/v2/v2BenchEndpoints.ts",
    "apps/api/src/agentRuntimeRegistry.ts",
    "apps/api/src/apiKeyStore.ts",
    "apps/api/src/authMiddleware.ts",
    "apps/api/src/conflictDetection.ts",
    "apps/api/src/conflictEndpoints.ts",
    "apps/api/src/consistencyMonitor.ts",
    "apps/api/src/costDashboardEndpoints.ts",
    "apps/api/src/dlqEndpoints.ts",
    "apps/api/src/evaluationRunner.ts",
    "apps/api/src/knowledgeStore.ts",
    "apps/api/src/lineageEndpoints.ts",
    "apps/api/src/memoryIndexManager.ts",
    "apps/api/src/pipelineEndpoints.ts",
    "apps/api/src/securityMiddleware.ts",
    "apps/api/src/sequentialExecutor.ts",
    "apps/api/src/store.ts",
    "apps/api/src/stores/apiStore.ts",